text,voted_up,playtime_hours
"7/10 - Painting Potential Solid ""friendslop"" fun with more potential! Gameplay Pose in different shapes and paint yourself to blend in your environment and hope you don't get found by the hunters! Very simple but great spin on a prop hunt/hide and seek game! Visuals Simple effective visual style - perfect for a hiding game. Only issue have is some lights are as bright as the sun and make it very hard to see anything in that area - very cheeky when people hide there knowing that! Sounds Hoping for more taunt sounds in the future. Linux Support Worked perfectly fine on CachyOS with native proton package. Improvements The core gameplay loop of this game is great, however there's some issues that need improvements. UI - It's very clunky, could definitely do with a freshen up to make things smoother. Steam invite support - Why can't I invite my friends if hosting private server? Server hosting/browsing - Lot of my friends struggled to join me - Needing full case sensitive name and password inputted to find server seems bit awkward. Have good faith in dev to continue working hard on this game, as only after 1 day we have workshop custom map support and a newly added score table tracking who has been seen the most without being found!",True,6
"The UI absolutely frustrates me, but the gameplay is fun.",True,0
"In the first round I spent two minutes finding the perfect spot on the shelf; painting the perfect camouflage, the textures was impeccable, the blend of colors seamless, every line blended together as though touch by Leonardo da Vinci himself, I had truly become one with the self, only to be shotgun blasted instantly by a guy shooting randomly from the opposite side of the room. The next round I paint myself white sat on a curtain and was never found. 10/10 will paint again",True,2
"bad controls and need binging resets, but otherwise such a fun game",True,3
"""That Aint Me""",True,6
"Fun party game, the painting and hiding works surprisingly well, although the pick colour tool is iffy. There are lots of fun fan-made maps so endless content.",True,3
fun hide and seek but no dark spots otherwise it sucks,True,7
The game is really really fun.. the only bad things are: -Cant invite friends through steam (Does nothing) -Cant Search for specific servers Otherwise the game it really really fun!,True,13
holy cow this game is bad,False,2
"Besides the fact that the eyedropper tool crashes my game, it is very fun to play with friends or in random lobbies.",True,4
you need language filters asap,False,3
"I haven't played much yet, but I do need to point out the negative reviews. Firstly, this game is amazing. It's an original standalone prop hunt game that has a unique twist you won't find anywhere. It's on the level of Among Us and other similar games where it is better with friends, but you do have the option for public games which can still be fun. I have noticed some negative reviews mentioning brush stroke size and characters always looking shiny when painting and trying to hide. I just want to mention, PLEASE for the love of god actually read the ui keybinds that are right in front of your face. You can change brush stroke size by right-clicking and dragging. They literally tell you that and some people still can't figure it out. How? And as for the shininess of the paint, just adjust the roughness. Roughness = Matte and Metallic = Shiny. Have none of you tried the different options? I have 4 hours in this game and figured it out after the first game I tried. Please for the love of god try some things before leaving an inaccurate negative review to a great game. And lastly, recent reviews have mentioned it is awful trying to play with friends because you can't directly invite them, or the search function doesn't work. I personally haven't had issues yet, but the dev also recently update to allow inviting to your private games. All around, this game does have bugs but is still worth the money. If the price tag was $20 I would still buy it and get it for friends. This game is amazing and every update from now on will only be an improvement. I highly recommend this game especially if you have friends!",True,8
"Honestly, anyone complaining about this game just doesn't know how to have fun. This game is a blast.",True,5
Yes i Recommend this Game. but the Frustration i have on the Control Bind in the Painting the Character is Worst and Even the Eye Drop that Cop[y the Color of Surrounding is not Working Properly . even i hate the Config when painting the Metallic and Roughness is Resetting. Even the Character Pose is Limited that i hate it,False,4
peak game though i did not make a good cactus,True,3
super fun with friends and cousins i played with my cousin dave77x,True,6
"this buggy garbage, was playing 1 day then the next after the update i couldnt find my mates server no matter what troubleshooting i did",False,4
its fun and gives me good laughs,True,9
good game pretty chill,True,5
Ive only played maybe 20 minutes but this game is fire ',True,0
"Really fun game. Loved playing with friends and made me laugh. I do think the controls and UI need some love, as it's pretty confusing and not the most user-friendly to actually paint with. But I'm excited to see this game develop and play more.",True,4
The famous painter would've LOVED this!,True,9
pretty fun and creative,True,3
"Overall a very fun ""friendslop"" game havn't tried to join random servers but I can reccomend if you have friends Please add 3rd person camera for hunters, have some friends who can't play first person as they get motion sickness, but can hide fine and love the game. It would be cool if they could hunt too!",True,4
"Great game, please make it Chromebook compatible so can play with my friend.",True,1
rlly good game that is fairly priced! fun with or without friends,True,5
"The game is honestly really fun and highly enjoyable, but it currently suffers from several major issues and bugs that completely ruin the experience. Here is a breakdown of the problems that need to be fixed as soon as possible: ​Griefing from the Lobby: Players who are still in the lobby can open their mics or type in chat to reveal the hiders' exact locations to the hunter. This completely ruins the fun of active matches. ​Spectator Issues: When new players join the lobby while a match is already running, they can see the entire map and everyone's locations. ​No Ban System & Game-Breaking Exploits: There are many toxic players using foul language, as well as hackers who ruin the gameplay. Even if we kick them, they can easily rejoin the server instantly because there is no proper ban system. Furthermore, some players somehow manage to join mid-match and remain completely invisible as hiders until the very end. They are impossible to find, and we can't even check the player list to see if they are actually in the game or not. ​Broken Settings & Controls: The settings menu doesn't work properly. For instance, you cannot customize keybinds or even change your microphone input device. ​No Way to Play with Friends: Playing with friends is a nightmare. There is no server search bar, no direct invite system, and no reliable way to ensure you can all join the same server together. ​Forced Background Music: The game music is mandatory, and there is no volume slider to lower it or turn it off. ​Deafening Lobby Sounds: The whistling feature in the lobby becomes incredibly annoying and loud when everyone starts spamming it at the same time, and we have no option to mute or adjust its volume. ​Conclusion: The core game loop has amazing potential and is very entertaining, but the developers desperately need to fix these quality-of-life, exploit, and moderation features. I hope to see these updates soon!",False,12
Very fun game to play with friends,True,7
"Simple but good. Just need to fix their server browser, some of the clipping on maps and allow for finer controls for positioning your character.",True,7
Watched my friend become a bale of hay 10/10,True,6
"game needs lots of improvements. like micro location adjustments, sometimes its impossible to rotate and position yourseld as you need. then sometimes you are totaly in the open and game is telling you that your location its not ok, but than other time, you can be buried more than 80% into the wall and the position is ok...",False,7
Very fun Please let me change my controls,True,1
"For $6.80 alot of fun, I enjoy it. Hosting your own map full of 25 players will fill pretty much in 5 minutes, lots of players. Very satifying when you pull off being hidden in a very obvious place. the main mechanic is great, I think the UI and button configuration really needs work. You can tell this game is a hacked together prototype with a very small team. Crazy to think this game is built on Unreal 5. Currently as of this review it has about 4-5 maps. you will burn through these quite quickly and they become tiresome. However Mod workshop is available, however is very clunky to develop for. Some Cons: - you are going to see Nazi swastika - there is going to be some racist remarks, and swearwords yelled out over the micophone - and you are likely going to see ♥♥♥♥♥ drawn on the characters. Besides that is a fun game. the general community seems okay. Keen to see what updates come out later. I can see this being a streamer crazy for the next few months. ill be interested in what updates and changes they do moving forward after all of this success.",True,9
"Very fun, excellent value. I would give this a solid 7/10, with the only points missing being: 1. It needs a way to make parties with friends or at least be able to search lobbies by name. 2. It needs some sort of moderation, there are way too many not even trying to hide it racist lobby names. 3. Some balancing on the maps, too many spots that are either too hard to see reasonably for the hunter or the against the spirit of the game. Hiding in a bucket is one thing, but being stuffed in a corner where they have to just shoot into the abyss and hope you're there is another. Would recommend, and look forward to future updates.",True,8
"The funniest game I've played in a long time. Play with friends, private server works amazing, so many fun workshop maps and its only been out 5 days now. This game has amazing.",True,5
0/10 being hunter sux,False,2
this was amuch more fun than i thought it would be,True,6
"Okay i like it, Picasso",True,6
i paint myself tungtung an noe 1 find mi,True,4
this game is very fun and silly,True,1
If anne frank played this game maybe she could have hid better.,True,10
Fun Party Game,True,10
"Great Game! Best with friends, Publics sound rough but if you get a couple of friends to play there's lots of fun to be had in this little game! As long as new maps come out frequently and also with the help of steam workshop it should be refreshing often. I think the most needed thing is a UI overhaul.",True,9
Fun game with friends where the goal is to figure how to join the same game.,False,0
"Horrible menu, ♥♥♥♥♥♥ Multiplayer system. Try joining public lobbies with a friend good luck. W cash grab on developers. game will be dead next week.",False,0
the game is fun but ♥♥♥♥♥♥♥♥♥ the server browser ruins the experience,False,3
Tremendous banger,True,2
Spent 5 minutes laughing at the server names. That's about the only good thing about this game. Looking at the reviews its also pretty clear all the positives are negatives who dont know how to select negative.,False,0
VERY much worth the few bucks I spent on this game most fun ive had with a new game in a long while. If your looking for a affordable fun multiplayer game I would for sure recommend this game.,True,6
They said to leave feedback in the reviews so... Please add vertical look inversion. Thanks. I'll change the review to a positive after the change is added.,False,2
"This game is an absolute blast with friends. We keep finding amazing spots and then attempting to camo ourselves perfectly, or just the most obvious hiding places and be amazed that the hunter cannot find us. I 100% recommend that you try this if you have friends and if you dont (most of you) there is a public match feature with in game voice and text chat so you can play all you want",True,10
Couldn't find my friend's lobby to play private game. Very hard to play,False,1
"I suck at painting but this has helped me some. I am now able to train as an american sniper in the military because of how its helped me train my camouflage skills, good game",True,4
"Worst UI design ever, not even ChatGPT from 2023 could pull off something this bad. Absolutely zero security. Anyone can play without owning it and the servers are P2P The gameplay and controls feel like a vibecoded roblox game, but it's fun nonetheless. 10/10 idea, 3/10 execution.",True,7
"Genuinely such a fun idea! I think this is for sure in its early stages, but I'm sure as time goes on this game will be improved on so much! As it stands right now, its well worth the six dollars in my opinion! You can get a few hours of fun out of it in its current state. I think the paint system is very cool, but it is a little hard to use to me. It took me a long time to realize spacebar was how the eyedropper tool worked. I think if there was an optional tutorial, that would help a lot to explain the mechanics of the game and what all of the keybinds do. I would also like to see controls customization, as I don't think this game has that yet, and brush options, like soft edge brushes or stamps. All in all this game was a lot of fun for me!",True,3
Started blinking after staying still mid game. fix game 2/100,False,2
Became a brick,True,5
Super fun when you watch people walk right past you,True,7
"This game is super fun with friends, but there's a few things that seriously turned me off from giving a better review. The multiplayer system is actually ass. You cannot invite friends normally and have to input a server name and password and refresh for awhile til it pops up. I'm also very disappointed by the fact there is no filter for server names, passwords, and probably the chat. When you look at the public servers, all the names are super discriminatory. Most of the public servers are named something with a slur, super racist, sexist, homophobic, or saying they like to touch children. It's also very glitchy and the ""you're too hidden"" mechanic is not very good. It triggers even when you're in a painfully visible spot. The UI could be much better as well. Higher graphic settings are an eyesore, especially when you're hunting or trying to match your color to your hiding spot. There's so many issues with reflections and my group and I found the game is much more bearable to play when you lower your graphics. At minimum I was expecting a proper multiplayer system instead of whatever the hell it currently is. This game has a lot of potential, but you get what you pay for. I will likely play some more of this since its pretty fun with my group and I love ""prophunt"" games, but I would only ever play this game with a group of friends. I don't recommend unless you have a group to play with.",False,2
Not fun or intuitive to play.,False,0
"Hid in balloons. Friend just randomly shot every single object in the room until he found me. (we had whistles every 30 seconds) Got an insane high score because I was in plain sight, he looked right at me many times. It's a great game to play with some friends, as it does take some skill and patience to perfect the right spot. But still leaves you wanting to get better as the hunter or the chameleon. 10/10",True,2
Horror game of the year by farrrrrrrrr,True,8
"This game is awesome but I think the person who has the lowest amount of Line of Sight points should get an auto-whistle. Typically people with the lowest amount of points are just hiding in BS spots. Also, hunters should have a slightly longer cooldown on shooting OR maybe a reload. Super fun though!!!",True,3
Controls are rough. Fun though.,True,7
cant beat it for the price,True,7
"Literally every server title is filled with slurs, it cannot be that hard to make a filter to remove these slurs. dev is probably racist.",False,4
Very fun game would def recommend if you have a group of friends that have pcs very cheap too which is good,True,1
Great game when you look past the awful user interface. I've applied to get an art degree and bought a digital drawing tablet to go pro in this.,True,11
poop from a butt (good),True,6
i LOVE THIS GAME IT IS FOR THE FUN AND FUN OF THE FUN,True,1
"games fun when i can ACTUALLY GET IN A DAMN LOBBY! i mean jesus christ, half of my time on this game is just me spectating or trying to get into a lobby that hasent already started, if your gonna show me a game where its already a minute in, ATLEAST MAKE ME SEEKER! but no, i just have to snipe open lobbys like im sniping a car in forza. please fix this",False,4
if youre drunk you get better at this game,True,4
"Why you should or should not play MECCHA CHAMELEON What is MECCHA CHAMELEON? In this game your goal is to play an intense game of hide and seek except the hiders have the ability to change what they look like in order to blend in with their surroundings. Quick Pros ✔ Unique mechanics ✔ Easy to learn controls ✔ Lots of different playstyles ✔ High replayability ✔ Active multiplayer community ✔ Fun cooperative gameplay ✔ Competitive modes are engaging ✔ Friendly player community Quick Cons ✘ Limited gameplay variety ✘ Matchmaking issues Initial Thoughts: -""OMG Look at me I am doing it! I AM PAINTING ON MYSELF"" -""You are never going to find me- oh the host left."" -""Okay- seriously this is the best hiding spot I have ever had you are never- oh you found me."" Beginner Player Friendly? I would argue this game is very beginner player friendly, it is a good price and has all the controls clearly labeled on the screen so you dont have to stress about forgetting something. This is also something your whole family can play. Game Play: The gameplay is simple- you want to hide, but also somehow in plain sight. You can either be a hunter or the hunted, if you are the hunter you have to find the others who have hidden around the map. And if you are the hunted or as the game calls you the 'Chameleons' then you have to paint your character to hide in the enviornments provided. There is not much more to it then that. Graphics: The graphics are simple and make sense for the style of game this is, if they were more complex then what it is now it may make it harder to hide in these enviornments. However, I am sure with the steam workshop being connected to this game there will be some pretty awesome maps coming out very soon and I have already seen a minecraft one popping up all over the place. I believe that this game could run on lower end systems. Community: Everyone on this game seems super fun even with the added voice chat. I have not run into anyone that isnt just there for a good time. So far this community all seems very genuine. How long can you play? So far I have only played for a limited amount of time and that is only because I was on a time crunch and had to work the next day. I think however this game would be super fun to play when you are having a drink and hanging out with friends. The playtime potential is very high and I think I have yet to put a few more hours into this game. My Opinion: In my opinion, this game is super fun and has a simple concept. I would argue it can be more fun with friends, however do not let that detour you from giving this game a try. Overall Review ★ 7/10 - Paint to survive, even if you are hiding in plain site... or as a horses scrotum. ✔ Active Online Multiplayer (meaning people will interact with you in game) ✔ Family Friendly (meaning friendly to all ages) ✘ Solo Playability (meaning you can play by yourself if preferred) ✘ Cross Compatibility (meaning you can play with friends through other consoles.) ✘ In-App Purchases (meaning you can buy things after buying the game i.e DLC's) ✘ Controller Compatible (meaning you can play this game with a controller) Enjoyed this review? Follow Basement Broadcast for more Reviews, Rants and Replays! https://store.steampowered.com/curator/46018670/ Any major edits that are made with this review will be added here:",True,1
Great Game Had A Lot Of Fun,True,5
Tbh this game is peak with friends. Mecca Chameleon is one of those games that will have everyone laughing and having a great time. Definitely looking forwards to cooking up more spots and maybe trying out some custom maps :),True,4
"This game is an easy way to kill a few hours with some friends. The movement is a little goofy, and there are some spots hiders can fit that can make it very difficult, if not impossible, to find or hit, but the anti clip system helps with this quite a bit. With mods supported, I imagine custom maps will also add more variation and replayability to the game. My only complaint is that the server search system feels a bit goofy, has an excess of slurs and profanity, and Steam invites don't seem to work. With all that in mind, I'd say it's worth the $5 price tag.",True,1
Yes this is a good game,True,5
"This gaim kinda stinks, hard to play with friends",False,0
can't really find friends games. Most public lobbies are slurs. Looked neat but yikes,False,0
its very cool I really like,True,3
Playing this game with the guys might have been the most fun I've had in awhile. Had a full lobby for five hours with us just dying laughing.,True,8
i hid as a ballon on the floor 5 people looking for me and i still won peak,True,25
"I was really skeptical going into this, figured it would be way too easy to see people - it ended up being a ton of fun even with just 4 people total. I can imagine with more it would get crazy. Definitely worth the sale price and 8 bucks off sale isn't bad either.",True,1
"If you love painting come, its the best place to enjoy with it",True,14
this was a fun friend game we played this on stream for nearly 4 hours!,True,3
Saw a guy paint himself as a turd in a toilet. He was the first to die.,True,1
"Love it, good with friends, modding community is good, except bendawg",True,15
Silly fun for a night with friends.,True,1
i need a drawing tablet,True,4
This game is a lot of fun especially playing with a big group of friends. The only real complaint I have for the game is trying to find public servers. There is no way to currently search for a public server with a name or a lobby code. The gameplay is a lot of fun and you can find some hilarious places to hide if you can paint yourself halfway decently.,True,8
Game is fun but no easy way to join/play with friends. no way to easily search or sort public servers. is this 2003?,False,0
"I love the game, but I have a few suggestions to make the gameplay more comfortable and engaging. 1. Please add an invite friends feature, for both private and public rooms. 2. Please add a search bar for make easier for searching the rooms. I often playing with 2-3 friends, but keep the rest of the rooms as public. I hope for more updates of this game!💗",True,10
"1, we need a way to compare the size of the brush to the shapes on the wall, 2 we need diff shaped brushes, a circle brush sucks at drawing squares, 3, we need a ruler/ straight edge tool,4, optionally, templates would be cool but arent important",False,2
janky slop but fun concept and its only $6,True,4
Best game ever,True,13
"overall a good came but what really ticks me off is the fact the game kicks u out in a lobby for no reason. I'm usually in the middle of a game and boom get sent to the menu for no reason. no its not my internet and its not me crashing its just random. i really feel like there's a way to fix that, but in all accession its really fun and somewhat addicting if u love to draw",True,4
This game is ♥♥♥♥♥♥♥ garbage,False,0
No keybinding options so pretty much a nightmare to play as a lefty.,False,4
So far good but keeps crashing during the darwing phase with all the settings turned down to the lowest.,False,0
super fun friend slop,True,6
"Played a few games, had some fun, learnt the controls and enjoyed the hiding mixed with painting, got called a slur in another language, someone said I was cheating cause of my hiding spot, got kicked. 10/10 exercise big fan even if I can't paint",True,0
cant stop playing,True,4
"This game was a blast. The server finding is definitely a lot to get used to, but it honestly wasn't too bad. I love the amount of props, as it's super disorienting and makes it truly difficult to find people. I look forward to more updates!",True,1
i hide as stuffed pengin,True,3
I enjoy this video game 👍,True,8
They patched it,True,10
"Peak, absolutley 0 censership and i love it",True,7
peak gameplay ac is so fun def pick it up,True,6
Love the game,True,9
Multiplayer is broken,False,0
This game is really good with your friends and if u don't have any join the dc and then join one of the voice chats it's a really good game thats funny and it has mod maps which is also cool too but i recommend you buy this game when on sale to save like $1 but it's cheap without the discount.,True,6
DRAW DRAW DRAW,True,11
Incredible time with friends!,True,4
I would like to enjoy the game but the amount of racially ignorant public servers was an extreme turn off,False,0
I don’t know a single control on this game,False,0
"Refunded because the color picker bugs out, and honestly just kinda boring if you're not playing with friends.",False,0
great game. fun with friends who play fair! please fix the hitboxes and add achievements.,True,5
Games great but literally the most stupid ♥♥♥♥ to invite a friend or find a lobby to join randoms please fix,True,7
