text,voted_up,playtime_hours
"very fun, more maps asap",True,9
the color dropper needs to be fixed and there needs to be a option to turn off the buried to much thing other wise its insanely easy for the seeker to always win. other wise its a great game to play with friends.,False,8
Absolutely amazing game with lots of potential,True,5
this is a really cool game with a interesting concept I love it outside the fact that you cant tell who is speaking using the proximity chat so people can yell out hate speech as much as they want,True,5
Feel like Picasso on crack.,True,3
its fun probably better if u have friends to play with but like its not bad just a bit janky also sometimes hiders can squeeze into small areas which are near impossible for the hunter to reach,True,2
Yeah both my friend and I were flashing red. I got hunter and could see where players were with the xray thing toggled and had to turn it off to give them a chance of not being seen easily. Players were being hunters and just going up and killing people easily because they could spot them. The moment another player stopped blinking red and giving them away was when I turned off xray. And they were blinking red and weren't even in the same room or even really visible to just be spotted. Terrible game. I was expecting this game to be different but was not fun.,False,0
i love the concept of the game tho i cant play it even after putting every setting into the lowest one even if i lower fps or anything it still crashes so that makes me unable to play the game which makes me sad cuz i really wanted to play it :( tho for people that have a good laptop or pc ill recommend the game a lot its a great experience.,True,0
Super fun game,True,5
The interface could use some work and add more options such as assigning a specific hunter. Played around 6 games with friends and I was the hunter majority of the time and my other friend didn't get picked once. But its a lot of fun with friends and for the price I highly recommend it.,True,1
"Game keeps crashing every 3-5 minutes, even when not running anything else. For the time I was able to play it felt rather unfinished.",False,0
we need new maps asap !!!!§,True,15
The game is fun and everything but it needs something to indicate the lobby status... I spent several minutes trying to join a server and they had already started it's kind of annoying,True,1
"Good Game, Lots of fun but will need more maps relatively soon!",True,3
This game is pretty fun other than the occasional broken hiding spot but they did help by making the maps a little bit brighter.,True,3
Can be very fun but filled with glitches and is clearly unfinished. Worth it for a laugh though,False,0
"Hra je spíš na jedno zahrátí, prostě typická hra co bych si zahrál na max. hodinku v robloxu. ještě je docela buggy a blbě se ovládá, ale hrozná není",False,1
"(-) interface need to be upgraded and also we need customization for key bindings, R F are the hardest keys to press in a limited time, its confusing. (+) its enjoying to explore new hiding locations every time, to see a new hiding place from another player and apply it on another game, fun very fun",True,3
"This game sells you an expectation that doesn't really match the reality of it. You may think that having a good artistic skill will make the game more fun and interesting, but actually, I more often than not found myself seeing a tiny limb from an enemy hiding within or behind furniture and shooting them that way. The best way to play is to not let enemies see your paint job and just play it like regular hide and seek. Cool idea but ultimately imo a failed attempt. Is it still fun enough to justify the rather cheap price tag? IMO no because the game is barely functioning. While there are not many bugs there are also NO features and a general aura of jank. You would probably have more fun playing just about any other prop hunt style game you can find. Note that this game is not listed as early access. I think this idea has some legs but not in its current implementation at all and I don't think there is any expectation for it to see impactful iterations. Wait and see.",False,0
"lovely game , very fun , maybe a better paint ui !",True,7
"So The UI right now is hideous. Like a child that is void of any creativity made it using Gimp or Paint. But that is not even the grossest part of the game. Its the community. Its like a bunch of Call of duty kids decided to play and populate the servers. You will see some of the most homophobic, racist, bigoted edge lords. If you have friends to play this game with, then I suggest you avoid public servers entirely. You will loose brain cells if you even dare read the lobby. And when you join the game, you will be greeted both with adults whos' brain is the size of my left nut specifically and the screeching, grating, scraping sound of teenagers half way in puberty. Disable voice chat if you can. Apart from that, the game is buggy, the options are lacking, there are important features that don't work, and there are a lot of cheatsy hiding spots. But if you can suffer through all that. The game is pretty fun.",True,6
"I got lost in this game for 3 hours, they keep updating and making the game better every time, they just added prox chat so it made the game 12x better",True,8
"Best fun I have had in years. Simple game but very fun indeed. Note to the devs : More maps and brush strokes and textures. You can monetize this by skinning the guns and the hunter avatars. Also the effects of the bullet when shot, you can sell that for skins and earn money.",True,15
Most optimized game,False,4
"yeah, its good",True,3
This game is good but its to hard to blend in stuff because of a recent shadow brightness update,True,9
"Very fun game! I'm the artist of my friend groups and the two friends I played with were shocked at my hiding places. Once, I was literally just standing by the wall in the backrooms lookin area, and they walked right past me. I'm very good at imitating textures. Graphics: pretty good. Different graphics game modes are very interesting. Gameplay quality: fun, easy to learn, consistent. Replayability: near infinite. Play to your heart's content. Bugs: Surprisingly not many. Very new game, some are expected. One of my friends got behind a shelf in a corner where literally no one could shoot him. But other than that not problematic. Cons: There are no different types of brushes, but it is acceptable because dithering is possible and effective and brush size is very adjustable. The drawing mesh is slightly pixel-y when drawing details. It can be very hard to shoot someone if they decide to run around. There are NO settings to look at or change keybinds. No apparent reporting system yet. Pro: skill based prop hunter. my friends are also becoming artists too. I'm very proud of them. If I haven't convinced you yet, buy the game, and get your friends to buy it.",True,8
This game better get a mention at game of the year,True,8
"Great game, tons of fun, very much worth $5",True,7
The MECCHA CHAMELEON is incredibly fun. I highly recommend playing this game,True,20
"At this stage the game is totally unplayable. Servers are unplayable, the longest i could play was 2 minutes. There is very minimal options and configuration, you generally don't even know what button is for what. It's full of game breaking bugs.",False,0
"This game is awesome. It's fun, easy to learn, and challenging yet easy at the same time. However, I'd like to request a feature. When you go to the ""find server"" screen, I wish it would show each server's status. Like if they are in a current game and how much time is left in that game. This would make it easier to find a game I can get into fast without having to wait.",True,13
"Loving this game! You guys should add a colourblind game mode where the hiders only see in Black and White and the seekers can see colour normally. And even add maps from videogames like Peaches Castle, Minecraft, and stuff like Castles, Nature, Oceans. Would be super cool. Even have diffrent paint brushes too! Loving the game so much fun!",True,7
we need an update for the AZERTY keyboard user please 10/10 game!,True,1
OOOOOOOOOAAAAAAAAAAAAAAAAAAAAAAAAAA,True,8
"@lemorion_1224 MECCHA CHAMELEON definitely has that indie jank—the menus and interface are pretty scuffed and desperately need some polish, like... A LOT. It also feels like it's missing a proper gameplay structure; adding an actual round system and a scoring mechanic—where hiders get extra points for risking a whistle—would be a GREAT addition. But once you actually get past the rough UI and into the game, it’s pure fun. We ran a 4-player group and we had a blast. It’s rough on the outside, but the gameplay loop with friends is absolute gold.",True,2
"Couldent play the game my freinds, none of the servers we made was visible.",False,0
This game has so much potential to be fun and it can be funny at times but the lighting and depth everything has makes it nearly impossible to actually hide. It's only really possible to blend in if you're perfect at choosing the colors for everything because the color picker tool hardly works. This game would heavily benefit from a more simplistic color palette in maps and simplistic lighting. The game is also really unoptimized. edit: realizing now that the games i were in had the whistling set to a lower timer which just let the hunters pinpoint you after like a minute. I do still have gripes with the lighting and color picker though. the color picker should 100% get an average within a small radius instead of the exact pixel (that also seems to change if there's a reflection.) Also a lot of things reflect light a lot for some odd reason despite those things not really being an object that should reflect light like that. You can clearly see in the trailer when they're painting themselves on the bricks that the bricks are shiny for some reason. You can also see how painting yourself with a strong reflection is really obvious due to your character being curved at the end of the trailer. Although the spot they chose there shouldn't be somewhere you hide anyways but it's the best example I can give since you can't add pictures to reviews or comments. the game doesn't absolutely need simplistic color palettes in maps just as long as actually painting yourself is made a little better. I'm not a huge fan of how your paint doesn't go around the body unless you can actively see that part of your body which can make painting something simple much slower than it has to be. also a fill tool would be extremely nice for quickly setting a base for your character. Also changing the size of the brush is weird and has something to do with the position your cursor is when you're trying to change it and could probably just be binded to something that increases/decreases it when pressed. I do think this game has a ton of potential still and with a few changes i could easily recommend it,False,0
"This game is great. The idea is unique and fun, It's like a more interactive version of Prop hunt. However there is quite a few flaws in its current state but considering the low price its definitely worth it. Hope this game improves overtime.",True,6
i hid as a cone and they didnt see my they walked right past,True,15
w but it takes awhile to find a server,True,2
"I don't review often but I'm seeing way too many negative reviews for what i think is easily the best hide and seek video game there is. I just would only highly recommend the game if you're going to play privately with friends currently. In Gmod hide and seek, every spot is basically determined by the map you play on and not your own creativity, and winning feels more like you were lucky because the seeker didn't check your spot. Prop Hunt improves that by allowing you to disguise yourself as a prop, but if you play the intended way and just blend in with other props, it feels like the same problem as regular hide and seek where you just hope you aren't shot at instead of the other props you're blending in with, which is why i mostly see people hiding as small bottles and just hiding in corners. But in this game, your spots feel truly your own, the ability to essentially hide anywhere as long as you can paint well enough makes everywhere a potential hiding spot, making spam shooting as a seeker essentially useless. if you're creative enough, you don't even have to simply blend in with a wall or anything, you can paint yourself into details that never even existed and get away with it, like the time i painted myself as a light bulb above a door, a bush in a pot, and even made my character do the sitting pose and hid as the letter L on a wall. It allows so much player expression in how they play and the strategies for where they hide, and makes the maps feel infinitely replayable. Naturally though there's some things that need to be fixed, and the best way i can put it is that the game basically necessitates monopoly-style house rules to keep it fun and fair. i think some maps (the sewer map especially,) has some nooks that are basically impossible to spot people hiding in because of the shadows (the wave breakers being the biggest culprit,) and i feel like a lot of the default rules are not balanced enough around the hiders like the 60 second hide time being too short. these are only really issues if you play on public servers i assume since with friends you can just ban shadow hiding, but it's still a massive issue, any game with the ability to play public servers should be designed around that, but it's why i stated i only highly recommend this game if you're playing with friends. The game has a workshop for custom maps and I am VERY excited to see what will come of it, but in the ones i've played the shadow issue is even worse than the official maps, which again makes playing without house rules impossible. This right here is the pinnacle of virtual hide and seek, and with friends it's already a blast, but it has some blatant issues that needs ironing out. but for a silly little indie game i got for 5 bucks? absolutely worth it. UPDATE 6/13/2026: the 1.2.0 update fixes the issue with loading custom maps AND adds an incentive to not just hide in shadowy corners by giving you a rank depending on how long and how close a seeker looks right at you without seeing you. considering it hasn't even been a week and they made these changes and more, AND added a whole new map, i'm even more impressed with this game and recommend it even more",True,8
Could use some touch ups in optimization and ui but ultimately an incredible and really fun concept!!! So good!!!!,True,4
very disappointed. 1. hard to hide- many areas are complete and it looks like nothing is missing. make spot where you can slot into or something 2. unlimited ammo- make a damn limit! its so unfun because people just spam shoot and find you instantly! 3. the being inside thing shows your location- i was barely in a thin chair leg and it pointed me out. fix please. 4. very laggy- need i say more? overall review 5/10,False,1
"I wanted to play this game so badly, I had seen the videos before release and it looked so fun. I finally got the game when it came out but I was never able to play with my friends because the UI so awfully horrible. It won't let you invite your friends to a lobby you're in, the ""Invite to Game"" feature doesn't work, its broken. There are so many servers, even with applying filters it won't show the same servers as your friends looking, and there is no search button to find them, so it's incredibly hard to find and get the same server up as your friends to join. After it would take ~5 minutes each time to find a server that appeared on both of our lists (again with 4 filters applied to narrow down the search) we would both join a lobby, then you see that the game is already in progress so you have to wait for it to finish, then after the game finally finished and we would get to play it would kick us both out of the lobby, with no error message or explanation whatsoever. This happened about 4 times. 4 times after we FINALLY were able to get into a lobby together and waiting the entire time for the current game to finish, it would just quick us out, no explanation, nothing. We spent 30+ minutes through this entire process just to try and play 1 single game. We never even got to play together, I am not going to play a game solo as it seems its best and designed with friends. Being that I never got into a game, I cannot speak to the gameplay and how fun it may be, but the UI and trying to find a game with your friends is so horrible that its incredibly hard just to play. For these reasons I cannot currently recommend the game, maybe in the future when they fix these issues I will try to come back, but in its current state it is literally unplayable. We could never get into 1 game. Good idea in practice for a game, but it definitely needs cleaning up before being worth getting.",False,1
"very fun game, cant wait for new maps",True,11
"Some pretty harsh critics for a $4 game up in here. MECCHA CHAMELEON has great bones and will most certainly improve with time. Yes, the UI looks like a 3rd grader's computer project and the paint tool needs just a bit of tuning but it's been a blast with friends so far. Hoping for more maps or a wider workshop down the line, but my friends and I enjoy what we've played so far!",True,2
"The game is fun, but the game really feels like a super early access game (but its not an early access game?). The UI needs a ton of polish, feels very clunky. The core gameplay is great, but more maps, modes, and brush styles would be much appreciated.",True,2
"Amazing game. The only bad things about this game is that you need friends to play it with, and that the ""random"" hunter and map selection doesn't feel random at all. Sometimes a player will be hunter 6 times in a row, and the same map will be picked 8 times in a row.",True,12
"cant join rooms, game crashed, kept getting booted back to lobby.",False,0
"The game feels like it was released too early. I was really excited about the concept, but I’m disappointed with the current state of its execution. That’s unfortunate, as the idea has real potential.",False,1
hide and seek with friends is 100x better,True,4
game-kun is peak!!!!! sugoi chan baka.-. bruh moment,True,5
cheap roblox paint to hide knockoff,True,6
"I originally couldn’t recommend this game due to the severe motion sickness it gave me, despite setting motion blur to 0 %. However, I downloaded a crosshair HUD overlay that helped immensely, as the static overlay helps anchor my view. Now I can actually enjoy the game, and I find it quite entertaining and creative. As others have mentioned, the game needs quite a lot of refining. The UI, controls and mechanics are somewhat confusing, and the servers are very unstable. Developers seem active though, and they already updated some of the UI elements. Due to the limited amount of maps, players have already learned different ways to clip through and behind objects, making it impossible for hunters to catch them. This makes the experience slightly less enjoyable, as the game feels more rigged that way. However, I just switch servers if I notice a lot of players doing this. All in all, it’s an original take on the hide and seek genre, and with the HUD overlay, I can actually enjoy it. I hope the developers fix the issues in the game to make it even better. Immediate wishlist: 3rd person view as hunter (helps with motion sickness), softer brushes, ability to create more textures/finishes than just metallic, ability to stick to diagonal surfaces, more maps, a rework of the maps that fill up any hollow areas unreachable to hunters.",True,7
I HATE THIS GAME! ITS BAD,False,0
This game was not good. Hosts kept leaving the lobby and the long wait time to play makes it boring.,False,0
This is a very cool hide and seek concept. I liked it so much i bought 9 copies for me and my friends. We had a great time. I am looking forward to seeing what else they add. Some more model poses would be great. And the ability to save paint work for the hunters and maybe the hiders. Maybe some paintable fun hats.,True,2
game was needs more work and better sever,False,3
It is a very fun game but jeez the rate of being hunter is crazy im only hunter,True,5
"Need some fixes specially the key bindings, but overall it's a casual, creative and fun game. Worth the price!",True,7
cheap game good,True,8
"No, it's not 'FriendSlop'. This game is incredibly fun and is an amazing take on such a simple premise. Hide and Seek is an entertaining game within itself but if you add the unique feature of painting yourself to adapt to your environment, it goes to a whole new level. I have only played this game for one hour yet it is some of the most fun I have had with my friends. I recommend this game to anyone who has at least two friends. Buy this game!",True,7
fun to play with friends and make up silly rules be fun if voice chat was a thing maybe scale then for hiders and limit how much shot hunters got and add accessory or tools to help hide or run when found.,True,17
best 4 dollars ive ever spent,True,2
Juan Luna would be proud,True,9
ay sound game,True,16
very fun game to play with friends,True,8
"Players from Meccha Chameleon are so stupid, they cant even see me in the most obvious spot i had to refund the game to get money",True,1
Really fun game!,True,5
its a okay game and it can be fun but i got rlly bored just sitting there,False,0
its soooooooooooooooooooooooooooooooooooooooooooooooooooooooooooooooooooooooooooooooooooooooooooooooooooooooooooooooooooooooooooooooooooooooooooooooooooooooooooooooooooooooooooooooooooooooooooooooooooooooooooooooooooooooooooooooooooooooooooooooooooooooo fun,True,0
hide from blind friends 👍,True,4
"It's fun but too many glitches, hiding as chameleon behind stuff the hunter can't find. like in the library(behind the books)",True,7
i saw this game on my fyp from a video and thought it looked fun lemme try this i wait till the 9th and then 2 days after when i had free time after work to play get on the game having fun in the lobby with strangers then i get booted from the lobby at first i thought everyone was kicking me untill i read the comments this week hasnt been the best and this was gonna be the distraction to take my mind off of other things but i cant even get into a game to expirence it which not only made my week worse but i normally dont get games off of steam :(,False,1
"Really great game, very unique concept. In the future I hope we can see more poses added to the game and possibly different brush types e.g. a brush that adds small dots to add minor defects which makes blending into environments which don't have a static color easier.",True,7
Its good. Just add a few tweaks to it to make it better and it will be a game killer.,True,4
"This game is genius, it is more fun than prop hunt in my opinion. Finding a good spot and painting yourself to blend in with your surroundings is really neat when you get into it. The game is best with friends but I also had a good time when I joined a random server. Well worth the $5, I would love to see them add more poses for hiders, along with some QOL improvements. Overall 9/10 game",True,5
"Good game, Just hope they add more maps and gamemodes because then it'd be really amazing",True,8
"Great fun with friends The price point is reasonable, but the game could use more maps, some UI and control improvements, and better character customization options. Also, seekers having infinite ammo feels unbalanced and encourages spamming. Overall, a fun experience with plenty of room to grow. i definitely recommend it",True,3
love this game but so buggy,True,4
"I've had tons of fun with this game so far. It has such a personality to it that makes the expirience really enjoyable. Some future features I would like to see is more painting tools to allow for an easier time painting textures and more maps. As for current problems with the game, whistling should reset the forced whistle timer and the forced whistle timer should be offset between players to avoid multiple player whistling at the same time, which makes it hard to get any useful info. The backrooms map needs a revamp, it's by far the worst map as a hider. I am loving this game and I can't wait to see how it grows.",True,5
good game they have big room for improvement.,True,7
"i had a review of this game, got called ♥♥♥♥♥♥, deleted review",True,5
"Its very clunky with very little places to hide. I feel it takes too long for a server to start, and it NEEDS better UI. Overall, its a cheap game and its fun for 20 minutes (that is if you even manage to get into the game and play it within that time), but I've played better games on roblox...",False,0
It is rough around the edges but a lot of fun! Check behind every piece of furniture and they end up being on the wall in plain sight. Gaming.,True,3
the most boring game ever dont buy this game you will regret it the wort 4 dollars that i spent,False,0
Absolute cinema,True,5
"Genuinely fun game! May be slightly rough around the edges, but has definite room to improve! Amazing job!",True,0
"Super fun and creative game, it's early access and the menus definitely need work, they are good enough to get a game running but not much more than that, But the game play is super fun and really funny. Your hiding spot is as good as you make it with your drawings Edit to add that the dev is continuously updating and improving the game really quickly!",True,4
