text,voted_up,playtime_hours
"So i hear this developer is shutting down not even a week after release. If this wasn't a cash grab, than i'm Times Square. It's a shame, because it could have been a really good game.",False,0
Game is getting shut down and i get stuck in a black screen,False,0
"This game was unfortunately mis-advertised and was not ready for release, but I'm not going to give up on it. Still has potential and just hope the DEVS know that. I'm not going to request a refund in hopes of improvement. FNTASTIC is not ACTIVISION. So there is still HOPE!",True,1
"I bought it for the glitches and to live the experience of being let down. With that said it was terrible even got a refund which was sweet. Shame on these devs, and anyone who made this.",False,6
This has been the worst release in video game history I WILL NEVER BUY a early access game againBecause of this company and its developers,False,14
hopefully someone with some money picks this up and runs with it and makes it the game it was supposed to be.... i still have a bit of hope otherwise i guess ill just wait for dayz 2. thanks anyways guys dontg listen to all these haters that live in mums basement eating moms spaghetti you did your best,True,3
Absolute trashcan,False,2
Went from being one of the most wishlisted games on steam to being shut down. I would be sad but these devs deserved this and I hope they learn from this failure.,False,0
"awful - got my refund, glad fntastic can do that correctly at least :)",False,3
"Just so you know, you're able to get a refund even though you've played more than 2 hours. Google ""More than 2 hours The Day Before"" and a reddit will pop up with helpful instructions.",False,13
not at all what was shown having PVE servers as well as PVP would of been a good idea assuming the game was even as advertised got more enemy players then i did zombies very buggy and very bad game,False,1
what the hell,False,1
honestly i had more fun stapling my ♥♥♥♥ shut than playing this hot garbage,False,3
This game was the main reason I made my switch to pc 😶 …. I played for 3hrs and left it alone just hoping it’d be better after they started updating it… days later they announced they were shutting the studio down and will not progress the game any further I submitted a refund before I even read the actual article 🫠,False,3
I had followed this game for the five years after 10 mins i thought this was a joke if u could make what u teased or showed u should have pushed it back and actual made a real game instead releasing this pile and i hope there a law suit out of this,False,0
for the most part i like the game. i knew for a early release there was going to be small issues. did not expect the studio to go under tho.,True,7
booty cheeks,False,1
What a garbage game. Devs took yo money and quit and closed studio. Glad I got my refund the day before,False,1
"This game is not what was promised. Even as a Extractor Shooter, its completely broken and empty. The Developer has closed shop, rather than fix the game and its not looking like this game will stick around. Do. Not. Buy. If you want a good Extractor, just go buy Escape from Tarkov",False,3
Absolute worse gaming scam i can remember in all my years. The studio who made this game shut down 3 DAYS after the game was released. NOT EVEN AN MMO,False,10
its not MMO game not like what they said,False,1
"I hope that at this point everyone knows that this was a scam to grab some money. I want to thank steam because it approved my refund after 20 hours of gameplay. So please, don't let this thieves run with some money and if you bought the game, go ask for a refund.",False,20
wow just bad. i was actually excited for this game when I first saw the release video and game play. This is nothing like how it was promoted or displayed. I am not sorry to see this company go.,False,14
"Disappointed with what transpired with this game. Hopefully, in the future, we get a company that can deliver the game that we've been waiting for. I speak for myself, after waiting years for this release it made me think differently about smaller companies, and should have done my homework. All the signs were there, but I ignored them because of my excitement for a new game. I stopped playing the game just over 2 hours in and knew this was a scam, Got my refund the next day. Good Luck Everyone!",False,2
"game ran like butt, had a few patches within 3 days which spawned more zombies and i even ran into more teams, it was fun on the 3rd day after those patches got released. ran splotchy at times but was fun for the most part after the patches and updates. game had a promising outlook, until the whole studio shut down and ended the game 3 days into early access. steam will give a full refund, if the ""bot""/wallet refund area declines it, send steam a support email and they will refund it, i had over 8 hours of gameplay and got a full refund. hopefully dayz switches to unreal 5 or buys the game out from whoever owns it now and releases it with the mmo and open world aspect.",False,26
Its better called 3 days after shutdown What a scam this is --- DO NOT BUY DEAD GAME STUDIO ---,False,1
"wow just wow, this game was a bad joke from the devs, really. in one game i only found 3 zombies and 5 items in like about 25 minutes of play. The game went so fast from 60k players to under 1k and studio closing in just 4 days. i think this is the fastest game to refund and lowest i played. the graphics looked so bad, frame drop, not to mention the gameplay what is that. in the end i feel bad for the devs, this game was the most wishlisted game. i didnt expected to be so bad. srry for all the people who had high hopes for this game",False,0
as homer simpson would say: D'OH,False,0
"""How embarrassing... how embarrassing"" Yoda, 22 BBY.",False,34
"Unfortunately the game developers prayed on the people desperate for an Open-World zombie MMO. If you own the game like me and have more than the 2 hr play limit for a refund. Try to get one anyway, I saw someone with 30+ hrs played get a full refund.",False,2
they collecting Ur money on good advertisement but the worst product possible,False,1
it's shutdown,False,9
Game is now dead. The Devs have abandoned all hope to save it. Looks like The Day Before shouldve never happened.,False,22
despite me having probaly a few hours on this game its because i spent 1 hour playing the actual game then all the other hours spent staring at the game itself and talking to myself asking why tf did i buy this horrible game,False,2
"There are many different ways a game fails upon release, for example, No Mans Sky had a very rough start, from lies to an unpleasant lack of game play, but they put in so much work to deliver what was originally promised, and even though it took a while to get there, they still managed to make a fun game with a lot of different aspects in regard to gameplay/creativity. But then you have a game like The Day Before, many lies, awful game, and overall, a failure to the community, all leading to show that this game is a complete SCAM. This game has been in ""development"" for years, just to come out as a game showing no effort or care. There are many MANY things that went wrong with this game, I won't go over everything as I have not done a load of research about all of the issues, but from what I have seen there are loads of bugs, possibly AI voice-overs, faking gameplay/alleged plagiarism in the trailers, delays, volunteers instead of employees to avoid paying for staff, and a bunch of other stuff (all over the Reddit and articles). If you look on the r/TheDayBefore sub-Reddit, there is a post showing all the asset packs from the Unreal Engine marketplace. Now there is no issue with using these assets, but the issue lies when FNTASTIC say that they are not asset flipping and lying to the community making out they are making everything themselves. At this point, it's obvious that FNTASTIC wanted to put something together, put the game out, and just run with the money, after 4 days of the release, they shut down the game and are trying to remove themselves from the internet and hide away. The Day Before had a lot of potential especially as one of the top-wishlisted games, but the FNTASTIC team was the cause of the downfall of this game. The game can no longer be purchased, and I wanted to keep the game rather than refund it as a reminder of the failure that happened here, also because it's just a funny L.",False,0
The game is shutting down don't buy,False,0
"Honestly a game with potential. It's an unfortunate situation, and I would have like to see where this game went. I also feel for this studio and other studios who are now going to use this situation as a deterrent from releasing their own games in fear of the social media gang mentality. Most of these negative reviews barely have an hour on record and have cast their judgement just as early as this game was released. It's really too bad all around. I hope in the future that people just stick to their Fortnite and leave new games alone. If you want a AAA experience maybe don't purchase something that's blatantly early access. And as for the developer, they should have been more transparent about the state of the game vs. the trailers that were released. Whatever, I'll go back to playing what Summit streams this week and watch Rick and Morty.",True,7
HORRIBLE SOCIAL EXPERIMENT GONE WRONG!!! STAY AWAY!!!!! DEAD GAME INSIDE!!!!!!,False,0
Not a bad game just not going to keep something that wont be updated and tweked,False,11
"I needed just 15 minutes to check the game out and then uninstall it. The rest of my game time was just waiting to join a server. It's been one of the most disgusting and dissapointing games that I remember. -The ""game"" had almost no mechanics -Many animations were UE's stock ones -It lacks functionality -A zombie apocalypse without zombies, I went out to the city and struggled to find more than one or two -An ""open world"" where you can enter like 2% of the buildings, and those that can be accessed are just a small commercial zone of about 50sqm or less, completely empty, of course. I could keep on writing but you get it. FNTASTIC said they spent 5 years working on this... ehm, what? Everything seen in the launch version could be done in less than 6 months by a skilled dev team of 3-5 people. Of course, I didn't even reach the 2 hour playtime and asked for a reimbursement.",False,1
"It is SCAM, Don't buy it",False,14
Christmas is Ruined.,False,1
How do I request a refund ?,False,5
what an absolute crap fest of a company. how do you release a title and then shut down the studio 4 days after launch. DO NOT BUY!,False,4
good gem better than cs2 No cheaters leeeeeka my bru,True,7
"game devs. listen to the players. they are your customer. Now you have to close your studio. I hope some other studio takes this and finishes it. WHAT A WASTE OF TIME, MONEY AND RESOURCE",False,0
BIG SCAM TINGS YEA!?,False,7
"they clearly put out this unfinished game to get a last min cash grab clearly this is fraud, they need to refund all who paid, not say oh ""this is going towards paying off our debts"" tf no give us our money back, figure out your problems like the rest of us..",False,0
what a exit scam ...,False,0
without a doubt the worst game ive ever spent money on,False,8
game is a scam all the company wanted to do is take your money and run,False,6
"Well, at least they broke a record!:)",False,15
"Awful... first time i played i spent the best of an hour looting and filled my bag, game crashed i spawned back in with nothing i had collected.",False,3
"Don't even bother, This game is not worth your time or money right now. It has the base to be a good game in the future but right now Its not worth, never refunded a game so quickly lol",False,1
i was scammed :'),False,1
"this was one of the highest anticipated games of the last few years and now the company who made it have given up, the IP needs to be sold and worked on, the problem with gaming now is the community are that impatient that companies are having to push out unfinished games and then wonder why they tank on release day",True,14
what a shambles of a game this has been from start to finish. i hope the people involved are never allowed to be a part of making a game ever again!!!,False,6
bought the game in hopes of a mmo online pvp as advertised for almost 3 years absolutely a lie is noone of the above I hope steam kicks them off there platform. I hope everyone else ask for a refund and bank rupts these lying dogs. wish there was a catergory in steam awards for biggest fraud and liar they would win hands down! refund got money back,False,0
♥♥♥♥ this game and the creators,False,11
I'm doing my part!,False,6
sadly the game was a scam I was looking forward to it being an actual game instead we got a mobile extraction shooter at best and poorly optimized at that.,False,4
game got refunded. Scamming company always will be known for it scummy tactics. disappointing really because this game if it was anything like the original trailers had so much potential. Lets hope someone else picks up on this aspect of a game and makes something promising and worth the wait for.,False,5
"Game is early access, so bugs are to be expected, but yes i actually love playing this game, and has massive potential. It is a game of survival, rpg, zombies, base building, weapon customization and a good story. It is sad the game stopped due all the harrasment, hate, and bullying on an extreme level. Hopefully some investors will come along and will figure out a way to help bring the game alive again, with fixes, etc etc.",True,12
well how can i say this i was hype for this game for years even though they released it and its was not what it was supposed to be it was enjoyable and decent lots of bugs but The thing that bothered me the most is the devs abandoning the project 4 days after release is a really low blows anyways hopefully they dont open a new studio and scam once more ...............................,False,19
dont get it...no zombies......no loot....just a piss poor experience...tried very hard to enjoy...just couldnt.,False,28
Very buggy but normal for an early access game. All hope was lost when the developers closed there doors after only 4 days of release.,False,18
And people where complaining about Infestation Surivor Stories (WarZ) Lmao... how can u release and close within not even one week. This must be a new record.,False,1
Falsely advertised game that was no where near completion as well as what we saw in the trailers. Scam!,False,2
this game dissapoints me in one aspect it ended before it could even get going given time and updates this game couldve reallt been something,True,21
Game is butt cheeks,False,5
all you bad reviewers are a bunch of ♥♥♥♥. wtf is all your problems this game has alot of potential. you all are scammed every year from games like call of duty buying a game that gives you the same ♥♥♥♥ every year and takes 70 dollars out of your bank. this game could be awesome and you didnt give it a chance at all. its 40 dollars an on early access.,True,23
Scammy scammy scam gotta love the try atleast we had smth to talk about :),False,2
What an incredible trailer! Too bad E3 got shut down.,True,4
This is not a real game. This is a SCAM,False,0
I liked the game but refunded since apparently thr studio is getting shutdown so theres no point in keeping it,False,0
i would like to refund its bad game,False,3
The Scam before. Don't buy!!,False,17
like full refund... waste of money.,False,4
"Wanted to give it a chance, but the company's closing. Could be such a great game.",True,0
HOW TO REFUND: HELP --> STEAM SUPPORT --> THE DAY BEFORE --> REFUND!!!!!! (refund worked for me with 18 hours playtime!),False,17
What’s the game everyone is playing in place of this one? What’s the game called that “the day before” was supposed to be?! Drop those game names please. And not Dayz I have 2k+ hours in that xD,False,39
"Ok so first of all we got given a game that wasnt what was promted, We got an extraction game instead of a MMO open world survival game but even with that I was like oh well lest make the most of this, It actually seemed a good game despite everything that just needed usual EA bug fixes. I supported the game even with all the haters just because I know new games will have issues. So for 4 days I was playing it and enjoying it, then on the 4th day when the Discord mods was speaking to us in Discord it was clear they had no clue what was going on, didnt even get any news from the devs and it was clear they got mislead what the game was. Then later on in the day the devs put out a messed on thier twitter saying they was closing the studio and all money they made was to pay off thier debts and just a bunch of poop followed that. So DO NOT ( not that you can anymore) buy this game and hopefully it gets taken off steam asap, The servers are still up but that cost money so since the devs wont be putting any more money into development those servers will soon be taken offline meaning you have a game that is full of issues and no servers to play. I would of recommended the game if the devs actually cared about it and had full intentions of stayingwith the game and didnt use it as a money scam but due to that i do not reccommend. ALSO THEY SAID EVERYTHING IN THE GAME WAS MADE BY THEM SELFS BUT GUESS WHAT IT WASNT, THEY ARE ALL ASSETS BOUGHT Only good thing that has come out of this is they are working with steam to make sure everyone can get a refund back",False,19
Nice Try...,True,4
I tried to like it.. i rly did. There is good pontial in it but for days after release and they are closing studio....there is no more hope i am not even mad just dissapointed that i rly trusted that they can do it.,False,19
"I did not have a chance to play the game. The servers were full and the game was loaded with servers issues. Fortunately, I was made aware of other negative reviews early enough to request a refund. After seeing the official statement of closure from the developer, it is clear there is an industry standard for developers to rely on ""Early Access funding"" for games, which is incredibly disappointing. I understand creating a game is not only costly, but also takes an incredible amount of time and effort; however, I believe if this game remained in development to deliver what was promised at Full Release, this would have been a success. I had high hopes for this game. I hope the failure of this development is a lesson for other studios its critical to release what you promise. Calling a half-finished game ""early access"" and still charging full price, expecting the community to be happy has become a risky practice.",False,0
total garbage.,False,1
"This should have been removed from the Steam store by now. Do NOT purchase. Studio was a snatch and grab. Took 4 requests to get my refund. If you get denied, keep asking for it. Make sure you tell the truth about your experience!",False,4
I was one of the lucky ones and got a refund 12 hours before the devs shut up shop... When they realised the game they promised wasn't possible they turned this into a scam.,False,2
The Scam Before,False,0
"The game shutting down and it is not as We or I expected! , So please spend your money on something else! I hope i can get my money back as well!",False,28
The biggest scam in the whole gaming history and it's not the best sandwich in the world,False,1
THE DAY BEFORE CLOSING THE STUDIO LMAO,False,1
Traaaaaaaaaaaaaaaaash,False,3
"So much hype just for nothing. I’m disappointed how much hope this community has for an open world mmo type survival game. Even if it was going to be an extraction shooter, this early access release was horrible. Almost everything in this game was asset flipped off of the unreal engine store, servers sucked and so many people couldn’t even play, and overall game mechanics and bugs made it unplayable. I could legit make this game in like 3 years by myself if I had the funds for all the assets they used and server space. SCAM GAME glad they are going out of business.",False,4
well well well,False,2
Go big or go home? Early access people it’s not at full capability. Listen if you want your game to be better my wife and I have some ideas DM me an I believe we can sort this thing out. I’m letting you keep the 40 dollars just hear us out an you might be able to rise once again. What’s the worst that can happen ?,False,0
"hmm...this game (the day before) too fast early access anythings haven't done yet improve....hope so the next update improving anythings then release it....specially is can do first person view be better...once (the day before) next generation update, im will purchase back this game thanks you....keep up Mytona Fntastic im knew developer do better.... :)",True,4
A game with a good concept but executed poorly its only pvp the pve Elements are allso no tthe best the developers set to high expectations,False,0
i am so sad about the game situation i had alot of fun i was looking forward for more updates and devs to listen to their fans but ppl didnt show mercy they always seeks perfection but shutting down the studio was a reason for everyone who had hope to refund the game i would have recommended the game i would love to see the same concept again in a willing studio,False,9
"все тут плохо. шляпа блин, 4 часа игры, из которых больше ждал соединения к серверам, теперь даже возврат не оформить... выкинул деньги получается",False,3
The only thing that Fntastic achieved was creating a meme that will last until THE DAY BEFORE,False,0
At least my ex sucked me off before taking my money away.,False,7
"i got this game in the hope it would live upto expectations but surprise surprise it didn't!! i still think the concept is great idea maybe the modding community can take this game and make it into something that it was suppose to be! that's if they can get hold of the game file's?? there is potential in this game but not in the company that released it, FNTASTIC deserves the book thrown at them TBH with the latest statement on shutting down the studio i think they will set up new studio and end up doing the same.",False,0
i know it's only 4 days into the game and everyone hated on it the first day but it's first day of course there gonna be some bugs but idc i like the game if they cant afford to keep it going hell give it to someone else and let them make it better ya know,True,71
"first hour trying to join a server ,second hour while playing found dupe glitch by trying to place ammo inside my another backpack ,third hour game died no one in servers ,fourth hour the developer suddenly announces shutdown",False,4
♥♥♥♥ is wrong with people making this utter hot garbage and then tuckin they third leg with 20 ms in there pocket. oooooouh boa you mfks better never drop another game Ill Burn that mfk,False,40
collectors item now UPDATE 23rd December: lmao guess not,True,0
Well that was a waste of time.,False,0
Game is shutting down - do not buy.,False,7
