text,voted_up,playtime_hours
I actually liked the game and wasn't that upset about it being an extraction shooter. Was happy to wait a couple months and see how it progressed but today the company tweeted that they ran out of money and will be shutting down. This is complete bs considering the game was the most wishlisted game on steam this year. Devs actually tried to bait and switch but luckily steam is still giving refunds to people who have more than 2 hrs playtime. It would also appear that steam completely disabled the purchase button. Lawsuit is definitely on its way.,False,10
I just be playing lego gta,True,22
will wait for a remake... ''the day after the day before'',False,2
would have been a good game if the studio hadnt folded after 3days into launch,True,16
Bomb their HQ,False,0
devs gave up 4 days after launch... put a large taint in one of my favourite genre of games...,False,2
SCAM !!!! TRASH COMPANY HOPE THEY GET WHAT THEY DESERVE !!!!! THEY SHOULD BE GET ARRESTED FOR STEALING PPL S MONEY AND HOPE!!!!!!! NEVER BUY A GAME BY MYTONA & FNTASTIC !!!!! GARBAGE DEVELOPERS !!!!!!!!!!!!!!!!!!!!!!! HOPE U DON'T GET ANY SUCCES IN YOUR LIFE WITH ANY WORK YOU DO!,False,9
What an disaster.,False,4
game was nothing like they had showed or promised in the EA contract and in the video. stay away n company has shut down.,False,45
bruh ♥♥♥♥♥♥ scan game.,False,4
idk why everyone is hating on this game yeah so what they lied about a few things but the game just came out and its gonna have its bugs and glitches they have a lot to work on but this game honestly has so much potential to be one of the greatest american extraction games out there i cant lie i love the game i do i enjoy playing it and everyone who is complaining about the zombies being to hard to kill well there are some people who like a challenge i like how the game operates they just need to fix a few things and this game could be solid,True,16
I like the looting,True,1
"Game shutting down less than a week after early access release? Good thing I bought 3 copies of this crap for me and my buddies. Hopefully, Steam will honor the refunds. DO NOT BUY.",False,6
"The game had potential but unfortunatly it was implemented wrong. Could have been great but def was not. I had hope but with no further updates due to the company being kaput, its not worth it. I just wanted the game to stop stuttering so much. I have a good PC, it was just stuttering so much. And when I got a murder on someone, sometimes they would dissapear along with their loot. Could have been fixed but will never now.",False,17
nothing like the videos they show,False,19
"Big yikes. its unfortunate because i did like what was there but obviously everything was a lie. I hope someone makes the ""Extraction Shooter"" that was here but without all the misleading trailers and promises of what the game would be.",False,3
"Game lacked what was advertised, and consistently crashed or unable to join a server",False,4
I Love The Day Before! I am a real Person!,True,6
DON'T BUY.. TOTAL SCAM! NOT AS DESCRIBED AT ALL. BROKEN AND UNPLAYABLE. HORRIBLE GAME!,False,3
"I bought it knowing it would be bad but holy damn, it was beyond any expectations. Just go play DayZ",False,8
"Good to see it was taken from the store. For those of you worried, my refund was processed even though I had 14 hours. Go request one.",False,14
"i cannot in good conscience recommend this game as once you play it, all other games will feel like a ps1 game. the game was so good they had to shut down their studios immediately due to the power they held with the day before. it was a power they couldn't handle knowing that other publishers/developers/studios wouldn't be able to compare their abilities to theirs. this is truly the game of a millennia that only comes once a decade.",False,0
????????????????????????????????,False,0
"my favorite feature of this game is that the studio ended up closing down: https://twitter.com/FntasticHQ/status/1734265789237338453 ewww, chile... GOD DON'T LIKE UGLY LMAO",False,10
"Trash game, cash grab. Steam should check better what's go on early access, this is a straight scam.",False,8
Absolutely not.,False,1
What a Joke,False,24
Don't buy this game! The gamestudio just shut down. Total scam!,False,5
"big disapointment had some good feelings about this game but it turns out to be nothing good , rather go again in the darkzone of the division its just the same looter booter",False,1
Company is shutting down 4 days after release lmao stay away,False,0
"Okay so I gave this game the benefit of the doubt and played for around 17hrs total. Ill start of by saying i am a huge lover of open world survival games the Apex of which by far is the open world survival game SCUM - Go check it out. However this is a review for the Day before. Although the game was falsely advertised overall as an extraction shooter it was pretty fun to play. The problem being is that is was nowhere near ready for early access. losing loot at load in, being disconnected from the team consistently, Missions felt half assed and sloppy and the player house cabin had no real use at all. The gun play was nice and it was nice to feel on edge while in the city kinda a similar type of edginess like the division 2 dark zone. 1 point to mention is that the suburb area of the map was beautifully designed and was some of the best POIS i have seen in a while and was fun exploring these areas. The game has shut down now and in light my refund was issued. Its hard being under fire from a community so I truly hope this didn't cause much stress to The Day Before team right before xmas.",False,16
Developer scammed everyone.,False,8
"Do NOT buy this game, the developers left their company, no more updates. SHAME!",False,2
What a bunch of Criminals! Liars! and Cheats!,False,2
"Imagine making such a ♥♥♥♥ show, other game dev companies reply to your tweet about how much of a scam you are.",False,0
Worse game ever released they should never be aloud to do business on steam ever again,False,4
what a waste...,False,0
the game was a big scam played for 40 min and refunded it because wasnt what it said it was,False,0
This game was a scam to start shutting down after 4 days of Dropping! Just a money grab. I hope they get sued.,False,15
"False advertising ,the game is nothing like the description and trailers , poor optimization and full of bugs .",False,14
Scam artist game. Never will i listen to companies who are advertising a game that sucks.,False,7
Absolute scam they have closed the studio down and admitted they are using everybody's money to pay of their own debts i have requested a refund and informed steam of this absolute and utter waste of time!!! the creators should be banned from selling anything i wish steam would have kept the game removed!!!!,False,6
REFUNDED AFTER OVER 10 HOURS!!! game is trash. no content - you pick weapons from basic vendors - you go through a door to the zone you can loot that barely has any zombies and youll run into players every so often VERY RARELY - than go to exit points - you got basic quests to get certain items to turn in for money to buy weapons backpack and basic extraction shooter stuff Thats about it. NO crafting Nothing Its a crap game,False,10
I really wanted this to happen. Game was far from perfect and did not reflect the price tag. But to be honest I was enjoying it with my friends. And had hope that they were going to work on this. But I was wrong. What a game it could had been :(. Now the game is 100% dead,False,25
"This game is a scam. The developing company has abandoned it with their greasy little pockets full of our money. They lied to us all for the past 3 years or so. Do not waste one cent on this P.O.S asset flip ""game""",False,23
THEY TOOK THE MONEY AND RAN BRO,False,11
"Game was a joke. Promised and no delivery, but still trying to take peoples money. Hopefully they give everyone refunds regardless of time played since they closed shop.",False,2
"good fun, has potential",True,9
I smell class action.,False,0
Press S to spit on this game's grave. Game is a massive scam and it got delisted,False,0
"The biggest scam I've ever seen/heard of. This type of game studio has no business being able to sell their ""products"" on Steam. Steam should be ashamed and be in fear of a class action lawsuit. BS",False,11
Huge Scam Huge Disappoint Huge Shame never give this company another change let them get rotten on their own dust,False,11
"Boopty doo, you can refund it too.",False,12
Its pretty bad,False,13
With a few updates can be bettet,True,35
Had high hopes for this game. The division and days gone in one was a neat idea. The developer closed down today so I got a refund. Make another company will try to make a game like they advertised.,False,2
I want to thanks steam for the refund.,False,14
This game is a joke and should not even be considered even if it becomes free,False,1
The Day Before the refund.,False,1
"This game has got y'all twisted. YES the first few days was rough because of the inventory and storage disappearing but once they fixed that, the game was FUN! True they didn't fix it fast enough but when they did it was a game I was looking forward to playing and feeling that Tarkov kind of feeling. I am very sad this game is dying and no one gave it a chance like Tarkov or Dayz got.",True,4
Studio folded 4 days after launch,False,6
Scam game for sure.,False,8
The Day After Scam,False,7
We've played with much worse games than this before. I don't understand why they did this. :( Is there anyone here who agrees with me? R.I.P :( #FREETHEDAYBEFORE,True,31
"Game had alot of potential, so many people complaining it wasn't what they expected. It was exactly what I imagined it would be, a mix of tarkov and dayz. There were some day one bugs but common we've all played day one before on an 'early access' game it was to be expected. Unfortunately the community didn't give them time to put out patches and make this into to 'what could have been' a GREAT game.",True,2
do not buy the game,False,13
"This game was a literal cash grab scheme, the company took all of our money, gave us a terrible game that wasn't even advertised, the closed literally 4 days after release. It's a scam 1/10 do not recommend.",False,21
game and fntastic is a ♥♥♥♥ show,False,10
"Fntastic shutting down, no more development. Do not buy/request your refunds",False,27
Studio is shutting down. Basically dropped the game knowing it was bugged just to make some money to pay debts and close shop.,False,4
"FNTASTIC Studio closed up shop 4 days after the release of this game that they kept putting off for the better part of 3 years. Nothing in their announcement videos, or game play videos looks or feels like the game they released. Moreover, this seems to have been a trend with this company releasing a gaming project, taking in initial funds and then abandoning the project. This game was the most anticipated game of the year but this company severely fell short on delivering a solid product. Starting with the server based online multiplayer. That in itself was a very poor judgment call. No Melee mechanics, Costs of items are ridiculously high, No story or plot to follow or appreciate, attachments for guns and ammo was lazy and confusing. Devs seemed to really favor attachments for the Deprov. Barely any attachments for pistols or snipers, what attachments were available, you had to go to a workbench to attach something that typically would be able to snap on or screw on in the field. Realism was non existent. This game truly let me down. I was hoping this would be the next ""Last of Us"". Honestly, instead of scrapping the project, they should GIVE it to Naughty Dog and have it be the game it was supposed to be. Extremely disappointing. Yes I am aware bad games happen, but those of us who are fans of LoU and have been following this game since inception with the idea that it would be as advertised, that is why its taken to heart. This game has/had a lot of potential but lacked the drive and willpower of the devs to really see it through.",False,9
"I was firmly in the ""this game isnt great, isnt worth $40, and needs major server help... but it's got potential"" camp... until the studio closed down the doors on day 3. I've refunded it. Still has potential -- needs VOIP, RPG elements, and work on hit registration -- but that's to be expected with an early access game. But now that the studio is shut down, I'll wait for another dev team to buy the IP (and offer a massive 50+% off sale) before jumping back in.",False,3
bought this game was only able to play it like 20 mins then never got to again because every time i went to load the game it black screened and then closed i really wanted to give this game a shot in hopes they would fix it im truly sad its gone the way it has i hope someone take up this project and fixes it,False,1
Just refund before it’s too late. I got refunded even after the 2 hour limit.,False,4
cant even buy this ass game any more lol,False,2
The worst game ever,True,0
"Would you like to refund the game, but you have already played more than 2 hours? 1. Go to STEAM, account details > View purchase history 2. Select > I have a question about this purchase 3. Write the following message: Dear Steam I would like to receive a refund after the announcement, I spent 20 dollars on a game that after four days no longer exists. https://www.forbes.com/sites/paultassi/2023/12/08/the-day-before-is-real-but-lied-about-everything-else/?sh=1aa6b76e574b https://twitter.com/FntasticHQ/status/1734265789237338453 Enjoy your money",False,14
Game/Studio is shutting down do not buy this,False,1
Lasted longer than dead matter win in my book gg,False,9
buyer beware - do not buy this game. Developer shut down 3 days after releasing early access.,False,5
Scamming Bastards,False,8
天上太阳红呀红彤彤诶 心中的太阳是毛泽东诶 他领导我们得解放诶 人民翻身当家做主人 咿呀咿吱呦喂 呀而呀吱呦啊 人民翻身当家做主人 天上太阳红呀红彤彤诶 心中的太阳是毛泽东诶 他领导我们奋勇向前进诶 革命江山一耶一片红诶 咿呀咿吱呦喂 呀而呀吱呦啊 革命江山一片红 我們心中的紅太陽 照得邊疆一片紅 長百千里歌聲嘹亮 海蘭江畔紅旗飛揚 千條江河歸大海 萬朵葵花向陽開 延邊人民縱情歌唱 我們心中的紅太陽 哎…毛主席 我們無限熱愛您 您的教導牢記心上 延邊人民祝愿您 萬壽無疆萬壽無疆 天上太阳红呀红彤彤诶 心中的太阳是毛泽东诶 他领导我们得解放诶 人民翻身当家做主人 咿呀咿吱呦喂 呀而呀吱呦啊 人民翻身当家做主人 天上太阳红呀红彤彤诶 心中的太阳是毛泽东诶 他领导我们奋勇向前进诶 革命江山一耶一片红诶 咿呀咿吱呦喂 呀而呀吱呦啊 革命江山一片红 天上太阳红呀红彤彤诶 心中的太阳是毛泽东诶 他领导我们得解放诶 他领导我们奋勇前进诶 革命江山一呀一片红诶 梭啦啦子梭啦啦子 一呀一片红诶,False,1
I tried to give this a chance it took like 2 hours to get the server and 1 hour to get in one with a friend the devs gave up on the game just look at the discord and announcements... and you will understand why I have never wanted a refund so bad if you paid for this I suggest you refund while you can regardless of playtime they have been honoring refunds above 2 hour playtime not sure how long that will last tho I pray none of get a over-hyped scam like this again this should not be tolerable just cause we all thought it might be fake off trailers,False,4
BIGGEST SCAM IN GAMING HISTORY!,False,14
"fun game, has some work but fun",True,4
I will keep this game as an NFT :D,False,4
SCAM. Studio already been shut down as this game has failed. They released a shell of a game to cash grab. Report the game and get a refund. THANK YOU STEAM for refunding even tho played 5 hours. Did the right thing.,False,5
i need mony me,False,14
"Do you want to pay a trash developers debt, well you're in luck because i got the just for you.",False,3
Too much hype for a hoax... where is the MMO Survival aspect of this ? Escape from Tarkov wannabe... RIP,False,0
"I'm unbelievably disappointed in this clear scam. We were hyped haphazardly over several years with promises and next to no proof there was really a game in development. They really did take a page out of Chronicles of Elyria's handbook. Whilst I was downloading the game, I went through a range of disbelief, doubt and relief, thinking that they'd grown their marketing strategy on something that was sure to sell; controversy. And grow it did, they either had the WORST marketing team and strategy, or the best. A few minutes into the game, i realised it was the former, 5 years? I doubt the 'team' worked on this for 5 months even. Absolutely shocking, the monotonous AI voices on poorly rendered characters to the bugs and the lack of basic functions of a survival mmo, which turned out to be just an extraction shooter. Stay clear away from this gods-awful scam.",False,0
"The game crashed and was impossible to load and play, on top of not being the game they told us it would be. Now the studio is shutdown. wish it was what we expected.",False,1
yes i would even with the game being early access their were alot of bugs but it has only been out for less then a week and people did not give it a chance game had good bones and should have been given a chance to come back from a bad release sorry the company has to shut down over not enough funding due to everyone refunding in like the first ten min of owning the game,True,14
This is the worst one yet by far.,False,5
"4 days in and the company is shutting down. Haven't seen a flop like this in... like, ever. Refund asap!",False,1
♥♥♥♥ and a scam,False,9
"""The Day Before offers players a uniquely reimagined journey into post-apocalyptic OPEN-WORLD MMO survival set in the present day on the US East Coast following a deadly pandemic.""",False,0
"I loved the game, just can’t believe they shut it down… please someone buy this great game an make it a masterpiece! I’ve been waiting for a game like this for years!!!!",True,11
Not represented accurately. As for what it was....had potential to be something decent but it is absolute trash and pre-alpha state. Now it no longer exists. The studio is trash for what they did.,False,3
"Unfortunately, It doesn't looks like in the videos they've shared. Also, there are lots of issues and the team is unresponsive to the community and the players. They don't update the game Also, the production team shared an e-mail about canceling the game.""",False,5
Request a refund if you bought this game. The studio is shutting down 4 days after release...,False,20
"played for 4.5 hours, and now im tryin to get a refund. game was empty and broken. dont waste your money",False,4
Much disappointed. Could’ve been a great game,False,3
The game shutting down after 4 DAYS?! That’s it. I’m saying the W O R D.,False,4
"Its sad they removed this game. The game has HUGE potential, great concept, great ideas, great systems, just terrible execution. The Devs should not have given up this easy. Yeah the game sucked on release but doesn't mean just abandon it and that's it. This game could've genuinely been great, it could've been close to what The Division 1 was, had the devs continuously worked on it, and updated it.",False,2
"Got my refund, get yours too",False,16
"No worst game,dont spent your money on it is not worth it.",False,8
been declined twice now for a refund wtf steam???,False,6
Didn't play enough. Was hopeful it was going to turn-around in a couple years and if the studio didn't shut down. C'est la vie.,False,1
"Even after 11 hours in the game steam refunded my money. That should tell you everything you need to know. I was one of the people who was willing to wait to see if the game got better over time. Now with the news that fntastic is shutting down after only 4 days post launch, i feel comfortable saying this game is litterally a complete scam.",False,11
this game is a scam the company is shutting down and not going to be update anything now and it is not a open world where do i go to get my refund?,False,5
"Scam game and company stay away,What a shame",False,10
ultimate scam studio closed 4 days after release,False,14
i cannot play it at all i keep respwning in the sky. and i cannot get a refund cuz i stayed in the game more than 3 hours ! in the sky !!,False,5
https://twitter.com/FntasticHQ/status/1734265789237338453/photo/1 LOL,False,6
"lol, lmao even. absolutely not.",False,11
♥♥♥♥ these scammers!,False,25
"Refunded after 30 mins, thankfully.",False,0
"False advertisement, Bait and Switch! The media shown to be in the game is exaggerated. Most features had no functionality or was extremely buggy like the base building and vehicle driving. Ended up being pointless features and the game focusing only on being an extraction shooter. A lesson must be learned from Fantastic did! I cant really feel bad for the company going bankrupt.",False,8
What a bunch of scammers man! Take our money and leave. Please give us our money back!,False,14
Biggest scam in gaming industry. Cash and grab company !,False,9
The day before lawsuit.Super hyped for the sequel.,True,37
Biggest scam alive.,False,0
"Company was liquidated 4 days after release, servers are open but game is broken please do not buy. I really had high hopes for this game, and this is the first game ive ever refunded purely because the company gave up.",False,6
"The hardest part for me wasnt even the delays, as bad as they were. Its the fact that Nakwon was in pre-alpha and had less bugs than a game in early access 😭😭. This game shouldve been free then maybe people wouldve worked with it more.",False,1
♥♥♥♥ YOU Fntastic and Mytona! I hope all of you dimwits never make money again from the gaming community.,False,0
Don't buy Game was not the same as what appeared in pre-launch trailer. Developers are slowly removing elements of their discord server as they try to slowly make off with thousands of peoples money.,False,2
"Trash game, everything sucks, empty world and boring gameplay Runs at 170-200fps on my 4090 but resolution support was also trash. They also abandon this game in such a short amount of time and closed down their studio",False,1
"I can't believe they scammed millions of people just today. After a couple days out, to be honest, that would've been a great game. But we just got word on the Discord that they were shutting down Discord as well. As the day before. This is very, very unprofessional scam. All these people and run away. I hope they get sued",False,17
This game is just not what it was sold as and now the company is packing up and dipping with the money just do not buy this game it shouldn't even still be listed on steam,False,1
The game was out for less then a week and the studio shuts down.,False,0
Bigger scam than star citizen,False,1
♥♥♥♥♥ stinky,False,19
"this is probably the biggest flop in history of a game, the dev team launched it 4 days ago and literally just stated they're closing their doors and aren't supporting this game anymore. they are known for scamming and we fell for it because the trailers looked so promising. i bought two copies and was able to refund both even after 15 hours played. i didn't have to email anyone i just did the normal refund process and explained it was a asset flip and they scammed everyone with the trailers and after about 30 minutes they refunded both my copy and my buddy's gifted copy. don't give up if they deny you keep trying to refund it regardless of the play time and eventually you will get it. also be sure to report this game to steam in hopes steam removes the game and allows everyone to have a refund.",False,15
can't believe the developers gave up so soon on a decent game no matter what people thought. they shouldve stuck it out.,False,36
very dissapointed,False,2
Insane fps drops/stuttering in the city no matter what combo of graphical settings I tried.. unplayable for me on a decent rig. Also game studio is shutting down lol so glad I refunded.,False,1
DO NOT BUY THIS GAME,False,1
The only thing is Fntastic about the devs is their arrogance.,False,1
Advertised the greatest game of all time. Delivered nothing. Took money and ran.,False,8
got a refund,True,2
Turns out the game WAS a scam.,False,6
"Already dead, 4 days later. And Steam won't give me my refund.",False,12
"It's a total scam; you can't play the game, there are no zombies, the map is a miniature copy of The Division, and joining a server can take hours.",False,7
Developers just shut down their studio after 4 days of release. DO NOT BUY.,False,12
"Game was good..till I found out they were closing servers Those who gave negativity to the game when it first game out failed to realize it was AN EARLY ACCESS game literally after the second day of release it was fixed, ""bug less"" and all Yes they did lie about aspects of the game but it was still fun Anyways Refunded because there is no telling when servers shut down",True,5
"SCAM... I got scammed, big oof!",False,14
"I wanted this game to be good but its just not... -Way over priced for something so bare bones. -Nothing functions actually works, AP ammo does not actually do anything, armor does not work, gun mods don't change gun behavior. -Quests are absolutely terrible and repetitive -No point of progressing because the entire economy if destroyed from duping -Already seen people RMTing currency in the central hub A real shame because this game could have been good but clearly the team leading this project are just completely incompetent",False,9
